{
  "world_version": "1.0",
  "world_sha256": "dddddddddddddddddddddddddddddddddddddddddddddddddddddddddddddddd",
  "entities": [
    {
      "entity_id": "entity:aaaaaaaaaaaaaaaaaaaaaaaaaaaaaaaaaaaaaaaaaaaaaaaaaaaaaaaaaaaaaaaa",
      "type": "Secret",
      "name": "API_KEYS",
      "aliases": []
    },
    {
      "entity_id": "entity:bbbbbbbbbbbbbbbbbbbbbbbbbbbbbbbbbbbbbbbbbbbbbbbbbbbbbbbbbbbbbbbb",
      "type": "Secret",
      "name": "DB_PASSWORD",
      "aliases": []
    }
  ],
  "events": [
    {
      "event_id": "event:1111111111111111111111111111111111111111111111111111111111111111",
      "type": "PolicyChange",
      "time": {
        "kind": "date",
        "value": "2026-03-01"
      },
      "actors": [
        "secops"
      ],
      "objects": [
        "entity:aaaaaaaaaaaaaaaaaaaaaaaaaaaaaaaaaaaaaaaaaaaaaaaaaaaaaaaaaaaaaaaa"
      ],
      "action": "`API_KEYS` must be never in source.",
      "state": {
        "API_KEYS": "never-in-repo"
      },
      "evidence": [
        {
          "source_id": "doc:1",
          "chunk_id": "chunk:1",
          "offset_start": 0,
          "offset_end": 20,
          "text_sha256": "1111111111111111111111111111111111111111111111111111111111111111"
        }
      ]
    },
    {
      "event_id": "event:2222222222222222222222222222222222222222222222222222222222222222",
      "type": "Config",
      "time": {
        "kind": "date",
        "value": "2026-03-02"
      },
      "actors": [
        "platform"
      ],
      "objects": [
        "entity:aaaaaaaaaaaaaaaaaaaaaaaaaaaaaaaaaaaaaaaaaaaaaaaaaaaaaaaaaaaaaaaa"
      ],
      "action": "`API_KEYS` are environment only.",
      "state": {
        "API_KEYS": "env-only"
      },
      "evidence": [
        {
          "source_id": "doc:1",
          "chunk_id": "chunk:2",
          "offset_start": 21,
          "offset_end": 40,
          "text_sha256": "2222222222222222222222222222222222222222222222222222222222222222"
        }
      ]
    },
    {
      "event_id": "event:6666666666666666666666666666666666666666666666666666666666666666",
      "type": "Config",
      "time": {
        "kind": "date",
        "value": "2026-03-02"
      },
      "actors": [
        "platform"
      ],
      "objects": [
        "entity:bbbbbbbbbbbbbbbbbbbbbbbbbbbbbbbbbbbbbbbbbbbbbbbbbbbbbbbbbbbbbbbb"
      ],
      "action": "`DB_PASSWORD` are environment only.",
      "state": {
        "DB_PASSWORD": "env-only"
      },
      "evidence": [
        {
          "source_id": "doc:2",
          "chunk_id": "chunk:1",
          "offset_start": 0,
          "offset_end": 20,
          "text_sha256": "6666666666666666666666666666666666666666666666666666666666666666"
        }
      ]
    },
    {
      "event_id": "event:3333333333333333333333333333333333333333333333333333333333333333",
      "type": "Deployment",
      "time": {
        "kind": "date",
        "value": "2026-03-03"
      },
      "actors": [
        "release"
      ],
      "objects": [
        "entity:aaaaaaaaaaaaaaaaaaaaaaaaaaaaaaaaaaaaaaaaaaaaaaaaaaaaaaaaaaaaaaaa"
      ],
      "action": "API_KEYS deployment completed.",
      "state": null,
      "evidence": [
        {
          "source_id": "doc:1",
          "chunk_id": "chunk:3",
          "offset_start": 41,
          "offset_end": 60,
          "text_sha256": "3333333333333333333333333333333333333333333333333333333333333333"
        }
      ]
    },
    {
      "event_id": "event:4444444444444444444444444444444444444444444444444444444444444444",
      "type": "Rotation",
      "time": {
        "kind": "date",
        "value": "2026-03-04"
      },
      "actors": [
        "secops"
      ],
      "objects": [
        "entity:aaaaaaaaaaaaaaaaaaaaaaaaaaaaaaaaaaaaaaaaaaaaaaaaaaaaaaaaaaaaaaaa"
      ],
      "action": "API_KEYS rotated after deployment.",
      "state": null,
      "evidence": [
        {
          "source_id": "doc:1",
          "chunk_id": "chunk:4",
          "offset_start": 61,
          "offset_end": 80,
          "text_sha256": "4444444444444444444444444444444444444444444444444444444444444444"
        }
      ]
    },
    {
      "event_id": "event:5555555555555555555555555555555555555555555555555555555555555555",
      "type": "Access",
      "time": {
        "kind": "unknown"
      },
      "actors": [],
      "objects": [
        "entity:aaaaaaaaaaaaaaaaaaaaaaaaaaaaaaaaaaaaaaaaaaaaaaaaaaaaaaaaaaaaaaaa"
      ],
      "action": "API_KEYS access was reviewed.",
      "state": null,
      "evidence": [
        {
          "source_id": "doc:3",
          "chunk_id": "chunk:1",
          "offset_start": 0,
          "offset_end": 20,
          "text_sha256": "5555555555555555555555555555555555555555555555555555555555555555"
        }
      ]
    }
  ],
  "relations": [],
  "unknowns": [
    {
      "kind": "missing_actor",
      "ref": {
        "event_id": "event:5555555555555555555555555555555555555555555555555555555555555555"
      }
    },
    {
      "kind": "missing_time",
      "ref": {
        "event_id": "event:5555555555555555555555555555555555555555555555555555555555555555"
      }
    }
  ],
  "conflicts": []
}
